{
  "variant": "SINGLE",
  "rings": [
    {
      "ringId": "halo.inner",
      "count": 16,
      "radiusMm": 3.4,
      "radiusYMm": null,
      "startAngleDeg": 0.0,
      "sweepDeg": 360.0,
      "zOffsetMm": 0.0,
      "memberScale": 0.22,
      "alignToRadius": true,
      "stoneRef": "primary",
      "gem": null,
      "settingRef": null,
      "members": []
    }
  ],
  "centerMemberId": "center",
  "label": "Classic single halo"
}
